{
  "schemaVersion": 4,
  "sessionSetName": "106-hello-world-tutorial-simplification",
  "status": "in-progress",
  "sessions": [
    {
      "number": 1,
      "title": "Session 1",
      "status": "complete",
      "startedAt": "2026-07-28T16:44:38.765283-04:00",
      "completedAt": "2026-07-28T20:01:52.360133-04:00",
      "orchestrator": {
        "engine": "claude",
        "provider": "anthropic",
        "model": "claude-opus-5",
        "effort": "high",
        "identityProvenance": "direct"
      },
      "verificationVerdict": "VERIFIED"
    },
    {
      "number": 2,
      "title": "Session 2",
      "status": "in-progress",
      "startedAt": "2026-07-28T20:29:03.196607-04:00",
      "completedAt": null,
      "orchestrator": {
        "engine": "claude",
        "provider": "anthropic",
        "model": "claude-opus-5",
        "effort": "high",
        "identityProvenance": "direct"
      },
      "verificationVerdict": null
    },
    {
      "number": 3,
      "title": "Session 3",
      "status": "not-started",
      "startedAt": null,
      "completedAt": null,
      "orchestrator": null,
      "verificationVerdict": null
    },
    {
      "number": 4,
      "title": "Session 4",
      "status": "not-started",
      "startedAt": null,
      "completedAt": null,
      "orchestrator": null,
      "verificationVerdict": null
    }
  ]
}
