{
  "schemaVersion": 4,
  "sessionSetName": "142-targeted-tests-and-run-of-record",
  "status": "in-progress",
  "sessions": [
    {
      "number": 1,
      "title": "The relaxation on the record, and deterministic selection",
      "status": "complete",
      "startedAt": "2026-08-19T16:30:21.503801-04:00",
      "completedAt": "2026-08-19T17:06:44.851602-04:00",
      "orchestrator": {
        "engine": "copilot",
        "provider": "anthropic",
        "model": "claude-opus-5",
        "identityProvenance": "asserted"
      },
      "verificationVerdict": "VERIFIED",
      "verification": {
        "rounds": 2,
        "verifierModel": "gpt-5.5",
        "verifierProvider": "openai",
        "transport": "copilot-cli",
        "costUsd": null
      }
    },
    {
      "number": 2,
      "title": "The refusal, and instructions that name the right command",
      "status": "not-started",
      "startedAt": null,
      "completedAt": null,
      "orchestrator": null,
      "verificationVerdict": null
    },
    {
      "number": 3,
      "title": "Changed-line coverage, and normalized deterministic facts",
      "status": "not-started",
      "startedAt": null,
      "completedAt": null,
      "orchestrator": null,
      "verificationVerdict": null
    }
  ]
}
