{
  "schemaVersion": 4,
  "sessionSetName": "130-orchestrator-seat-cost-capture",
  "status": "in-progress",
  "sessions": [
    {
      "number": 1,
      "title": "The reader that refuses to guess",
      "status": "in-progress",
      "startedAt": "2026-08-14T02:37:00.005297-04:00",
      "completedAt": null,
      "orchestrator": {
        "engine": "github-copilot",
        "provider": "anthropic",
        "model": "claude-opus-5",
        "effort": "high",
        "identityProvenance": "asserted"
      },
      "verificationVerdict": null
    },
    {
      "number": 2,
      "title": "The join key, recorded instead of dropped",
      "status": "not-started",
      "startedAt": null,
      "completedAt": null,
      "orchestrator": null,
      "verificationVerdict": null
    },
    {
      "number": 3,
      "title": "The contract, the report, and the corrected number",
      "status": "not-started",
      "startedAt": null,
      "completedAt": null,
      "orchestrator": null,
      "verificationVerdict": null
    }
  ]
}
