{
  "schemaVersion": 4,
  "sessionSetName": "087-module-organized-projects-foundations",
  "status": "in-progress",
  "sessions": [
    {
      "number": 1,
      "title": "Session 1",
      "status": "complete",
      "startedAt": "2026-07-10T12:20:03.170046-04:00",
      "completedAt": "2026-07-10T13:59:55.802151-04:00",
      "orchestrator": {
        "engine": "claude",
        "provider": "anthropic",
        "model": "claude-fable-5",
        "identityProvenance": "direct"
      },
      "verificationVerdict": "VERIFIED"
    },
    {
      "number": 2,
      "title": "Session 2",
      "status": "complete",
      "startedAt": "2026-07-10T15:53:06.813460-04:00",
      "completedAt": "2026-07-10T18:24:16.921878-04:00",
      "orchestrator": {
        "engine": "claude",
        "provider": "anthropic",
        "model": "claude-fable-5",
        "identityProvenance": "direct"
      },
      "verificationVerdict": "VERIFIED"
    },
    {
      "number": 3,
      "title": "Session 3",
      "status": "complete",
      "startedAt": "2026-07-10T18:32:37.218379-04:00",
      "completedAt": "2026-07-10T20:33:04.987591-04:00",
      "orchestrator": {
        "engine": "claude",
        "provider": "anthropic",
        "model": "claude-fable-5",
        "identityProvenance": "direct"
      },
      "verificationVerdict": "ISSUES_FOUND"
    },
    {
      "number": 4,
      "title": "Session 4",
      "status": "not-started",
      "startedAt": null,
      "completedAt": null,
      "orchestrator": null,
      "verificationVerdict": null
    }
  ]
}
