{
  "schemaVersion": 4,
  "sessionSetName": "093-work-explorer-module-row-interactions",
  "status": "not-started",
  "sessions": [
    {
      "number": 1,
      "title": "Session 1",
      "status": "not-started",
      "startedAt": null,
      "completedAt": null,
      "orchestrator": null,
      "verificationVerdict": null
    },
    {
      "number": 2,
      "title": "Session 2",
      "status": "not-started",
      "startedAt": null,
      "completedAt": null,
      "orchestrator": null,
      "verificationVerdict": null
    }
  ]
}
