{
  "schemaVersion": 4,
  "sessionSetName": "048-lightweight-tier-parity",
  "status": "in-progress",
  "sessions": [
    {
      "number": 1,
      "title": "Audit pass + scope-lock",
      "status": "complete",
      "startedAt": "2026-05-26T16:45:56.054453-04:00",
      "completedAt": "2026-05-26T17:19:45.432266-04:00",
      "orchestrator": {
        "engine": "claude-code",
        "provider": "anthropic",
        "model": "claude-opus-4-7",
        "effort": "max",
        "chatSessionId": null,
        "checkedOutAt": "2026-05-26T16:45:56.054453-04:00",
        "lastActivityAt": "2026-05-26T16:45:56.054453-04:00"
      },
      "verificationVerdict": "manual_attestation"
    },
    {
      "number": 2,
      "title": "--no-router mode + tri-state schema/runtime + soft gate",
      "status": "complete",
      "startedAt": "2026-05-26T17:44:48.561045-04:00",
      "completedAt": "2026-05-26T18:26:52.378714-04:00",
      "orchestrator": {
        "engine": "claude-code",
        "provider": "anthropic",
        "model": "claude-opus-4-7",
        "effort": "max",
        "chatSessionId": null,
        "checkedOutAt": "2026-05-26T17:44:48.561045-04:00",
        "lastActivityAt": "2026-05-26T17:44:48.561045-04:00"
      },
      "verificationVerdict": null
    },
    {
      "number": 3,
      "title": "Copyable-prompt commands + Context-menu IA refresh (COMBINED per audit Bias 7 flip)",
      "status": "complete",
      "startedAt": "2026-05-26T20:02:59.716458-04:00",
      "completedAt": "2026-05-26T20:40:41.709100-04:00",
      "orchestrator": {
        "engine": "claude-code",
        "provider": "anthropic",
        "model": "claude-opus-4-7",
        "effort": "max",
        "chatSessionId": null,
        "checkedOutAt": "2026-05-26T20:02:59.716458-04:00",
        "lastActivityAt": "2026-05-26T20:25:00.000000-04:00"
      },
      "verificationVerdict": null
    },
    {
      "number": 4,
      "title": "Doc revision + per-consumer migrator + bootstrap tier-branch",
      "status": "in-progress",
      "startedAt": "2026-05-26T21:08:10.796755-04:00",
      "completedAt": null,
      "orchestrator": {
        "engine": "claude-code",
        "provider": "anthropic",
        "model": "claude-opus-4-7",
        "effort": "max",
        "chatSessionId": null,
        "checkedOutAt": "2026-05-26T21:08:10.796755-04:00",
        "lastActivityAt": "2026-05-26T21:08:10.796755-04:00"
      },
      "verificationVerdict": null
    },
    {
      "number": 5,
      "title": "UAT + change-log + version bumps + publish",
      "status": "not-started",
      "startedAt": null,
      "completedAt": null,
      "orchestrator": null,
      "verificationVerdict": null
    }
  ]
}
