{
  "schemaVersion": 4,
  "sessionSetName": "069-automated-pull-critique-capabilities",
  "status": "in-progress",
  "sessions": [
    {
      "number": 1,
      "title": "Execution-evidence protocol + evidence-tiered findings",
      "status": "complete",
      "startedAt": "2026-06-16T04:22:51.012512-04:00",
      "completedAt": "2026-06-16T05:10:57.454345-04:00",
      "orchestrator": {
        "engine": "claude",
        "provider": "anthropic"
      },
      "verificationVerdict": "VERIFIED"
    },
    {
      "number": 2,
      "title": "Trusted-command execution + diff-awareness + deeper probing",
      "status": "in-progress",
      "startedAt": "2026-06-16T05:18:15.226406-04:00",
      "completedAt": null,
      "orchestrator": {
        "engine": "claude",
        "provider": "anthropic",
        "model": "claude-opus-4-8",
        "effort": "high"
      },
      "verificationVerdict": null
    },
    {
      "number": 3,
      "title": "The probe-template lane (the missing middle)",
      "status": "not-started",
      "startedAt": null,
      "completedAt": null,
      "orchestrator": null,
      "verificationVerdict": null
    },
    {
      "number": 4,
      "title": "Podman model-authored-probe lane (GATED on a green spike)",
      "status": "not-started",
      "startedAt": null,
      "completedAt": null,
      "orchestrator": null,
      "verificationVerdict": null
    },
    {
      "number": 5,
      "title": "Ceiling -> floor ratchet + measured replacement gate",
      "status": "not-started",
      "startedAt": null,
      "completedAt": null,
      "orchestrator": null,
      "verificationVerdict": null
    },
    {
      "number": 6,
      "title": "Synthesis + docs + release + dogfood + close",
      "status": "not-started",
      "startedAt": null,
      "completedAt": null,
      "orchestrator": null,
      "verificationVerdict": null
    }
  ]
}
