{
  "schemaVersion": 4,
  "sessionSetName": "129-suite-owned-input-sets",
  "status": "in-progress",
  "sessions": [
    {
      "number": 1,
      "title": "The suite declares its inputs",
      "status": "complete",
      "startedAt": "2026-08-13T14:07:24.470680-04:00",
      "completedAt": "2026-08-13T16:24:05.900234-04:00",
      "orchestrator": {
        "engine": "github-copilot",
        "provider": "anthropic",
        "model": "claude-opus-5",
        "effort": "high",
        "identityProvenance": "asserted"
      },
      "verificationVerdict": "VERIFIED"
    },
    {
      "number": 2,
      "title": "A5 answered, and the apparatus refused",
      "status": "not-started",
      "startedAt": null,
      "completedAt": null,
      "orchestrator": null,
      "verificationVerdict": null
    }
  ]
}
