{
  "schemaVersion": 4,
  "sessionSetName": "080-getting-started-subchoice-legibility",
  "status": "complete",
  "sessions": [
    {
      "number": 1,
      "title": "Row-structured option layout for both sub-choice groups",
      "status": "complete",
      "startedAt": "2026-07-05T15:58:00.060798-04:00",
      "completedAt": "2026-07-05T16:16:55.098817-04:00",
      "orchestrator": {
        "engine": "claude-code",
        "provider": "anthropic",
        "model": "claude-fable-5",
        "effort": "medium"
      },
      "verificationVerdict": null
    },
    {
      "number": 2,
      "title": "UAT, screenshot, and release",
      "status": "complete",
      "startedAt": "2026-07-05T16:20:18.481626-04:00",
      "completedAt": "2026-07-05T20:47:30.417641-04:00",
      "orchestrator": {
        "engine": "claude-code",
        "provider": "anthropic",
        "model": "claude-fable-5",
        "effort": "medium"
      },
      "verificationVerdict": "VERIFIED"
    }
  ]
}
