{
  "schemaVersion": 4,
  "sessionSetName": "094-getting-started-shrink-and-manifest-lifecycle",
  "status": "in-progress",
  "sessions": [
    {
      "number": 1,
      "title": "Session 1",
      "status": "complete",
      "startedAt": "2026-07-12T04:40:40.883363-04:00",
      "completedAt": "2026-07-12T06:43:13.666686-04:00",
      "orchestrator": {
        "engine": "claude",
        "provider": "anthropic",
        "model": "claude-opus-4-8",
        "effort": "high",
        "identityProvenance": "direct"
      },
      "verificationVerdict": "VERIFIED"
    },
    {
      "number": 2,
      "title": "Session 2",
      "status": "not-started",
      "startedAt": null,
      "completedAt": null,
      "orchestrator": null,
      "verificationVerdict": null
    }
  ]
}
