{
  "schemaVersion": 4,
  "sessionSetName": "131-outsourcing-policy-restoration",
  "status": "in-progress",
  "sessions": [
    {
      "number": 1,
      "title": "The pin comes out, and the rule that replaces it",
      "status": "in-progress",
      "startedAt": "2026-08-14T07:44:41.410692-04:00",
      "completedAt": null,
      "orchestrator": {
        "engine": "github-copilot",
        "provider": "anthropic",
        "model": "claude-opus-5",
        "effort": "high",
        "identityProvenance": "asserted",
        "seatSessionIds": [
          "e2af3ac5-6957-459b-859a-893737cae0e7"
        ]
      },
      "verificationVerdict": null
    },
    {
      "number": 2,
      "title": "The number that is not a price",
      "status": "not-started",
      "startedAt": null,
      "completedAt": null,
      "orchestrator": null,
      "verificationVerdict": null
    },
    {
      "number": 3,
      "title": "Rotation, the lever that was never written down",
      "status": "not-started",
      "startedAt": null,
      "completedAt": null,
      "orchestrator": null,
      "verificationVerdict": null
    }
  ]
}
