{
  "schemaVersion": 4,
  "sessionSetName": "078-copilot-cli-hybrid-tier",
  "status": "in-progress",
  "sessions": [
    {
      "number": 1,
      "title": "CLI contract discovery and design lock (go/no-go)",
      "status": "in-progress",
      "startedAt": "2026-07-04T05:58:16.330002-04:00",
      "completedAt": null,
      "orchestrator": {
        "engine": "claude-code",
        "provider": "anthropic",
        "model": "claude-sonnet-5",
        "effort": "medium"
      },
      "verificationVerdict": null
    },
    {
      "number": 2,
      "title": "Transport layer and catalog lockfile",
      "status": "not-started",
      "startedAt": null,
      "completedAt": null,
      "orchestrator": null,
      "verificationVerdict": null
    },
    {
      "number": 3,
      "title": "Routing integration, verification provenance, honest accounting",
      "status": "not-started",
      "startedAt": null,
      "completedAt": null,
      "orchestrator": null,
      "verificationVerdict": null
    },
    {
      "number": 4,
      "title": "Live dogfood and UAT",
      "status": "not-started",
      "startedAt": null,
      "completedAt": null,
      "orchestrator": null,
      "verificationVerdict": null
    },
    {
      "number": 5,
      "title": "Docs, path-aware critique, coordinated release",
      "status": "not-started",
      "startedAt": null,
      "completedAt": null,
      "orchestrator": null,
      "verificationVerdict": null
    }
  ]
}
