{
  "schemaVersion": 4,
  "sessionSetName": "132-session-length-and-explorer-captions",
  "status": "in-progress",
  "sessions": [
    {
      "number": 1,
      "title": "Two captions, said plainly",
      "status": "complete",
      "startedAt": "2026-08-14T12:41:40.611993-04:00",
      "completedAt": "2026-08-14T13:55:33.419498-04:00",
      "orchestrator": {
        "engine": "github-copilot",
        "provider": "anthropic",
        "model": "claude-opus-5",
        "effort": "high",
        "identityProvenance": "asserted",
        "seatSessionIds": [
          "4771184e-ac47-482b-9c0e-652c6759cfbd"
        ]
      },
      "verificationVerdict": "VERIFIED"
    },
    {
      "number": 2,
      "title": "Fix the instrument before trusting it",
      "status": "in-progress",
      "startedAt": "2026-08-14T14:00:48.630825-04:00",
      "completedAt": null,
      "orchestrator": {
        "engine": "github-copilot",
        "provider": "anthropic",
        "model": "claude-opus-5",
        "effort": "high",
        "identityProvenance": "asserted",
        "seatSessionIds": [
          "e9e541c3-35e3-4b56-b619-ca7d78acd763"
        ]
      },
      "verificationVerdict": null
    },
    {
      "number": 3,
      "title": "Why the tail, what N should be, and where compaction fires",
      "status": "not-started",
      "startedAt": null,
      "completedAt": null,
      "orchestrator": null,
      "verificationVerdict": null
    }
  ]
}
