{
  "schemaVersion": 4,
  "sessionSetName": "108-three-module-pipeline-tutorial",
  "status": "in-progress",
  "sessions": [
    {
      "number": 1,
      "title": "Session 1",
      "status": "complete",
      "startedAt": "2026-08-03T11:57:22.818681-04:00",
      "completedAt": "2026-08-03T13:53:16.838234-04:00",
      "orchestrator": {
        "engine": "claude",
        "provider": "anthropic",
        "model": "claude-opus-5",
        "effort": "high",
        "identityProvenance": "direct"
      },
      "verificationVerdict": "VERIFIED"
    },
    {
      "number": 2,
      "title": "Session 2",
      "status": "complete",
      "startedAt": "2026-08-03T13:56:40.555568-04:00",
      "completedAt": "2026-08-03T14:54:34.205557-04:00",
      "orchestrator": {
        "engine": "claude",
        "provider": "anthropic",
        "model": "claude-opus-5",
        "effort": "high",
        "identityProvenance": "direct"
      },
      "verificationVerdict": "VERIFIED"
    },
    {
      "number": 3,
      "title": "Session 3",
      "status": "complete",
      "startedAt": "2026-08-03T14:56:53.672405-04:00",
      "completedAt": "2026-08-03T16:32:46.240563-04:00",
      "orchestrator": {
        "engine": "claude",
        "provider": "anthropic",
        "model": "claude-opus-5",
        "effort": "high",
        "identityProvenance": "direct"
      },
      "verificationVerdict": "VERIFIED"
    },
    {
      "number": 4,
      "title": "Session 4",
      "status": "not-started",
      "startedAt": null,
      "completedAt": null,
      "orchestrator": null,
      "verificationVerdict": null
    }
  ]
}
