{
  "schemaVersion": 4,
  "sessionSetName": "070-dual-surface-verification-telemetry",
  "status": "in-progress",
  "sessions": [
    {
      "number": 1,
      "title": "Steelman push + the dual-surface comparison core",
      "status": "complete",
      "startedAt": "2026-06-16T11:47:35.038823-04:00",
      "completedAt": "2026-06-16T12:39:26.758353-04:00",
      "orchestrator": {
        "engine": "claude",
        "provider": "anthropic",
        "model": "claude-opus-4-8",
        "effort": "high"
      },
      "verificationVerdict": "VERIFIED"
    },
    {
      "number": 2,
      "title": "Provenance merge + the fair-shake telemetry + mode wiring",
      "status": "complete",
      "startedAt": "2026-06-16T13:19:32.237511-04:00",
      "completedAt": "2026-06-16T14:40:44.045697-04:00",
      "orchestrator": {
        "engine": "claude",
        "provider": "anthropic",
        "model": "claude-opus-4-8",
        "effort": "high"
      },
      "verificationVerdict": "VERIFIED"
    },
    {
      "number": 3,
      "title": "Synthesis + docs + release + dogfood + close",
      "status": "in-progress",
      "startedAt": "2026-06-16T15:38:40.181553-04:00",
      "completedAt": null,
      "orchestrator": {
        "engine": "claude",
        "provider": "anthropic",
        "model": "claude-opus-4-8",
        "effort": "high"
      },
      "verificationVerdict": null
    }
  ]
}
