{
  "schemaVersion": 4,
  "sessionSetName": "072-verification-tuning",
  "status": "in-progress",
  "sessions": [
    {
      "number": 1,
      "title": "Matrix-mode seam + L-069-1 sibling-reader hardening",
      "status": "complete",
      "startedAt": "2026-06-19T06:27:49.197965-04:00",
      "completedAt": "2026-06-19T06:40:45.816723-04:00",
      "orchestrator": {
        "engine": "claude",
        "provider": "anthropic",
        "model": "claude-opus-4-8",
        "effort": "high"
      },
      "verificationVerdict": "VERIFIED"
    },
    {
      "number": 2,
      "title": "External-target wrapper + per-cell telemetry + report artifact",
      "status": "complete",
      "startedAt": "2026-06-19T08:39:14.278649-04:00",
      "completedAt": "2026-06-19T09:09:35.113557-04:00",
      "orchestrator": {
        "engine": "claude",
        "provider": "anthropic",
        "model": "claude-opus-4-8",
        "effort": "high"
      },
      "verificationVerdict": "VERIFIED"
    },
    {
      "number": 3,
      "title": "Cross-run remediation aggregator",
      "status": "in-progress",
      "startedAt": "2026-06-19T09:15:45.356342-04:00",
      "completedAt": null,
      "orchestrator": {
        "engine": "claude",
        "provider": "anthropic",
        "model": "claude-opus-4-8",
        "effort": "high"
      },
      "verificationVerdict": null
    },
    {
      "number": 4,
      "title": "Synthesis + docs + release + dogfood + first external run + close",
      "status": "not-started",
      "startedAt": null,
      "completedAt": null,
      "orchestrator": null,
      "verificationVerdict": null
    }
  ]
}
