{
  "schemaVersion": 4,
  "sessionSetName": "075-greenfield-finding-power-pilot",
  "status": "in-progress",
  "sessions": [
    {
      "number": 1,
      "title": "Protocol + addendum + rubric + aggregation contract",
      "status": "in-progress",
      "startedAt": "2026-06-20T09:33:22.608641-04:00",
      "completedAt": null,
      "orchestrator": {
        "engine": "claude",
        "provider": "anthropic",
        "model": "claude-opus-4-8",
        "effort": "high"
      },
      "verificationVerdict": null
    },
    {
      "number": 2,
      "title": "Consumer enablement + deferred-repo record + close",
      "status": "not-started",
      "startedAt": null,
      "completedAt": null,
      "orchestrator": null,
      "verificationVerdict": null
    }
  ]
}
