{
  "schemaVersion": 4,
  "sessionSetName": "067-pull-verifier-adapter-experiment-a",
  "status": "in-progress",
  "sessions": [
    {
      "number": 1,
      "title": "Session 1",
      "status": "complete",
      "startedAt": "2026-06-15T09:10:32.813110-04:00",
      "completedAt": "2026-06-15T09:43:33.508514-04:00",
      "orchestrator": {
        "engine": "claude-code",
        "provider": "anthropic",
        "model": "claude-opus-4-8",
        "effort": "medium"
      },
      "verificationVerdict": "VERIFIED"
    },
    {
      "number": 2,
      "title": "Session 2",
      "status": "complete",
      "startedAt": "2026-06-15T10:08:08.343557-04:00",
      "completedAt": "2026-06-15T10:35:55.595637-04:00",
      "orchestrator": {
        "engine": "claude-code",
        "provider": "anthropic",
        "model": "claude-opus-4-8",
        "effort": "medium"
      },
      "verificationVerdict": "VERIFIED"
    },
    {
      "number": 3,
      "title": "Session 3",
      "status": "not-started",
      "startedAt": null,
      "completedAt": null,
      "orchestrator": null,
      "verificationVerdict": null
    },
    {
      "number": 4,
      "title": "Session 4",
      "status": "not-started",
      "startedAt": null,
      "completedAt": null,
      "orchestrator": null,
      "verificationVerdict": null
    }
  ]
}
