{
  "schemaVersion": 4,
  "sessionSetName": "082-omit-verification-mode-from-full-tier-scaffolds",
  "status": "in-progress",
  "sessions": [
    {
      "number": 1,
      "title": "Conditional template line + tier-gated marker",
      "status": "complete",
      "startedAt": "2026-07-06T11:07:00.827777-04:00",
      "completedAt": "2026-07-06T11:28:50.486851-04:00",
      "orchestrator": {
        "engine": "claude-code",
        "provider": "anthropic",
        "model": "claude-fable-5"
      },
      "verificationVerdict": "VERIFIED"
    },
    {
      "number": 2,
      "title": "Cold-start UAT and release",
      "status": "in-progress",
      "startedAt": "2026-07-06T11:31:35.474903-04:00",
      "completedAt": null,
      "orchestrator": {
        "engine": "claude-code",
        "provider": "anthropic",
        "model": "claude-fable-5",
        "effort": "medium"
      },
      "verificationVerdict": null
    }
  ]
}
