{
  "schemaVersion": 4,
  "sessionSetName": "090-verifier-preclose-review-scope",
  "status": "complete",
  "sessions": [
    {
      "number": 1,
      "title": "Session 1",
      "status": "complete",
      "startedAt": "2026-07-10T15:08:18.454523-04:00",
      "completedAt": "2026-07-10T15:47:43.194057-04:00",
      "orchestrator": {
        "engine": "claude",
        "provider": "anthropic",
        "model": "claude-opus-4-8",
        "effort": "high",
        "identityProvenance": "direct"
      },
      "verificationVerdict": "WAIVED"
    }
  ]
}
