{
  "schemaVersion": 4,
  "sessionSetName": "068-cadence-study-and-contract-gate",
  "status": "in-progress",
  "sessions": [
    {
      "number": 1,
      "title": "run_test disposable-worktree sandbox + tool (+ ReDoS isolation)",
      "status": "complete",
      "startedAt": "2026-06-15T14:19:55.555511-04:00",
      "completedAt": "2026-06-15T15:00:47.837192-04:00",
      "orchestrator": {
        "engine": "claude-code",
        "provider": "anthropic",
        "model": "claude-opus-4-8",
        "effort": "high"
      },
      "verificationVerdict": "VERIFIED"
    },
    {
      "number": 2,
      "title": "Experiment A symmetric re-grade + Experiment B pre-registration",
      "status": "complete",
      "startedAt": "2026-06-15T15:28:59.007889-04:00",
      "completedAt": "2026-06-15T16:15:00.249132-04:00",
      "orchestrator": {
        "engine": "claude-code",
        "provider": "anthropic",
        "model": "claude-opus-4-8",
        "effort": "high"
      },
      "verificationVerdict": "VERIFIED"
    },
    {
      "number": 3,
      "title": "Experiment B - the cadence study",
      "status": "not-started",
      "startedAt": null,
      "completedAt": null,
      "orchestrator": null,
      "verificationVerdict": null
    },
    {
      "number": 4,
      "title": "Routed keep / demote / retire decision",
      "status": "not-started",
      "startedAt": null,
      "completedAt": null,
      "orchestrator": null,
      "verificationVerdict": null
    },
    {
      "number": 5,
      "title": "Contract-test / CDC gate",
      "status": "not-started",
      "startedAt": null,
      "completedAt": null,
      "orchestrator": null,
      "verificationVerdict": null
    },
    {
      "number": 6,
      "title": "Synthesis + docs + release + dogfood + close",
      "status": "not-started",
      "startedAt": null,
      "completedAt": null,
      "orchestrator": null,
      "verificationVerdict": null
    }
  ]
}
