{
  "schemaVersion": 4,
  "sessionSetName": "053-ci-agnostic-schema-drift-enforcement",
  "status": "in-progress",
  "sessions": [
    {
      "number": 1,
      "title": "Session 1",
      "status": "complete",
      "startedAt": "2026-05-29T20:34:03.567104-04:00",
      "completedAt": "2026-05-29T21:01:51.774850-04:00",
      "orchestrator": {
        "engine": "claude",
        "provider": "anthropic",
        "model": "claude-opus-4-8",
        "effort": "high"
      },
      "verificationVerdict": null
    },
    {
      "number": 2,
      "title": "Session 2",
      "status": "not-started",
      "startedAt": null,
      "completedAt": null,
      "orchestrator": null,
      "verificationVerdict": null
    }
  ]
}
