{
  "schemaVersion": 4,
  "sessionSetName": "example-session-set",
  "status": "complete",
  "sessions": [
    {
      "number": 1,
      "title": "First session: scoping + scaffolding",
      "status": "complete",
      "startedAt": "2026-04-30T13:00:00-04:00",
      "completedAt": "2026-04-30T13:50:00-04:00",
      "orchestrator": {
        "engine": "claude-code",
        "provider": "anthropic",
        "model": "claude-opus-4-7",
        "effort": "high",
        "identityProvenance": "direct"
      },
      "verificationVerdict": "VERIFIED"
    },
    {
      "number": 2,
      "title": "Second session: implementation + close-out",
      "status": "complete",
      "startedAt": "2026-04-30T14:00:00-04:00",
      "completedAt": "2026-04-30T14:30:00-04:00",
      "orchestrator": {
        "engine": "claude-code",
        "provider": "anthropic",
        "model": "claude-opus-4-7",
        "effort": "high",
        "identityProvenance": "direct"
      },
      "verificationVerdict": "VERIFIED"
    }
  ],
  "nextOrchestrator": {
    "engine": "claude-code",
    "provider": "anthropic",
    "model": "claude-opus-4-7",
    "effort": "high",
    "reason": {
      "code": "continue-current-trajectory",
      "specifics": "Session 2 verified clean; the same orchestrator is well-positioned to continue with Session 3."
    }
  }
}
